Name,Description,Last Updated,Version
New Update Release,"We've made minor updates to make it easier for you to provide feedback or leave a review—no need to click an external link anymore.

Additionally, we've added our other published templates to the ""Read Before Using This Template"" section, helping you discover and explore more Notion templates effortlessly.","February 21, 2025",V1.5.10
New Update Release,Enhanced template with additional details for improved clarity and functionality.”,"January 24, 2025",v1.5.5
New Update Release,Made small adjustments and refinements to improve functionality and user experience.,"January 16, 2025",v1.5.0
New Update Release,New Template Released Today – What's New and Improved!,"January 1, 2025",v1.0.0